review,word count,char count,stopword count
"Starbelly is always a solid stop for a meal in the Castro. I came here for dinner during Pride weekend and it was busy but still not a long wait to get a table. The cocktails were strong, the food was flavorful and fresh. We got the thai spiced pork sausage (tasty bites), the white bean puré (creamy!), and the spahgetti (solid) along with the steak skewer (a great bite) Will definitely be coming back on my next visit.",79,421,30
"Stopped by for a late brunch in the Castro and overall enjoyed the experience.The weekend brunch menu is creative with enough variety. I recommend the French toast and their spring gazpacho was refreshing. The house (Starbelly) salad was average, but I think people come here for the multiple cocktail options for happy hour.I appreciate their heated outdoor seating, and indoor space is also quite welcoming. Service was nice and attentive.",70,441,24
"Cutest place, sat outside in the back and the heaters are abundant, so you will not get cold. Ordered micheladas and a couple other cocktails and all were great. The food is on point, every single thing was so yummy. We ordered the Starbelly bacon pizza, the green goddess sauce on it is a game changer, so good. The other item you must order is the chicken and French toast, everyone at the table tried it and loved it. The service was fantastic!",83,447,36
My family and I had a great time last Friday night for dinner. Food are reasonably price with a good portion and wonderful flavor. Staff are nice. Service is fast. The ambiance is upbeat. I like the back patio where we were seated. Definitely will come back.,47,258,16
"Starbelly is one of those places that feels like home away from home. It is on the intersection in the Castro neighborhood and there is street parking available on the weekdays. Finding parking was easy and we were able to walk around to see some shops.Arriving at happy hour, there is a display with a huge array of drinks behind the counter. We were greeted by the happy manager Adam and we encountered a couple who told us that Starbelly's pizza is something to die for. Starbelly provided some cool tones inside. My friend and I sat in the patio that has a covering on the top with star decorations on the walls. It was nice that the heater was on. Some nights in San Francisco can get pretty chilly.The server Chris (I hope I spelled their name correctly) was very kind and inviting. She was very patient when we asked about specific ingredients from the menu.My friend went for the burger and fries during happy hour and I ate margarita pizza. The couple was right. The pizza was fantastic and it wasn't salty compared to some places I have visited in San Francisco. The French fries were crunchy and I love it.I think what makes this place so attractive is that people like Adam and Chris make sure that your experience is memorable. In tough days or just an exploration, they invite you to return to their humble and charming restaurant. I just wished I took a picture of the food but we got so hungry that the food has been demolished in less than a minute.Thank you for having us here, Adam! We will come back again. :)",280,1529,121
"I'm here for the beautiful cocktails, easy atmosphere, minimal lines for weekday brunch, the amazing blonde waitress that made our day and simple California-style menu :-)Perfect place for catch up time with your friends, beautiful outdoor covered area / sunroom. Just gives you a happy feel good vibe and their menu served perfect portions for a table for 2",59,358,19
Food is great and simple! No frills- we got CHF i Ken and waffles and the salad with grilled chicken. Portion for the salad was quite small. But fresh. Prices are great. The one downside is the service is super slow probably because only one person was working the whole back patio felt bad for him. Our drinks never arrived.,60,325,20
"Starbelly is a neighborhood gem that needs to be a part of everyone's regular rotation. It's a great option for a weeknight burger and fries, but the star for me is when you have a weeknight pizza craving. The bacon pizza is so scrumptious. The crispy crust with melty cheese and crisp bacon is a combo to salivate over. The arugula adds a nice peppery touch. This specific night I decided to try the Toffee Cake, and added a scoop of the seasonal ice cream, which was the Chocolate Caramel Crackle--the two together was AMAZING. I'm going back just for that dessert combo.",103,573,41
"One of my favorite places in San Francisco to have delicious & beautiful food with wonderful cocktails. My go to is the house made pate - decadent, white bean dip - beautiful, fries with 3 dips - LOVE (goes so well with a martini) and wonderful Starbelly salad. Although the pizzas are phenomenal there too.The service is on point- upbeat, and very attentive and knowledgeable of the menu.Had the newest cocktail -Passionflower: tequila and passion fruit. I tend to order a vodka martini, but this sounded so amazing.! And it was so yummy. I'll add more to my review the next time I go. I just go so often that, silly me, forgot to give them the a great review ;)",121,663,44
"Made reservations for Wednesday brunch at 11:30, upon arriving we were seated promptly. Inside of the restaurant was pretty vacant but the patio in the back was full. Food: Challah French Toast - great sweet brunch option, two large slices of custardy french toast serve with strawberry conserve, mascarpone and pistachios, not too sweet and surprisingly light definitely worth ordering if you're looking for something sweetButternut squash pizza - a really interesting combo of flavors, base was a pesto along with black garlic, ricotta salata, pepitas and butternut squash, crust was good, crisp and chewy, a bit on the greasy end but over pretty tasty Bibb lettuce salad - tasty, salad was probably dressed, and well seasoned, bacon was crisp, chicken was well grilled, overall a very good classic saladFries - thin and fried crisp, my preferred style, can't go wrong,  thoroughly enjoyed the trio of sauces that came with them Service was good, no complaints, were offered water and coffee refills when needed. Overall one of my favorite spots in the city for an affordable brunch or dinner. Food is always dependably good, drinks are reasonably priced and the menu maintains a good balance of classic dishes along with interesting seasonal offerings.",203,1255,66
"Good place if you want a cheap restaurant (we spend 60$ in 3) or an easy reservation. Speaking of the food, they have basic dishes. The quality is ok, not something very outstanding but you can easily enjoy. The ambiance is nice and the service is pretty fast and efficient.",50,274,21
"Went around 11:30 am on Sunday and ordered the chicken and waffles here for the second time and they're still as good as I remembered them to be. The portion size, presentation, chicken to waffle to ratio is perfect for me. The chilaquiles was also delicious but I'm not sure if it's worth the price. It's such a cute place. Service was a bit slow, but it was also pride day.",71,375,30
"Great food, drinks and service at an affordable price. Great ambiance as well. Highly recommended",15,97,4
"Came here for happy hour after a hike and thoroughly enjoyed the $20 burger deal ($20 for a burger, fries and a cocktail). We each ended up getting that deal and were so happy and full afterwards and continued with a few roses. Will gladly come here again for the happy hour and great service.",55,293,26
"In the heart of the Castro, there's outdoor seating, bar seating & a hidden patio in the back. Well-designed interior & you can see the chefs prepare your food as well! I went on a tuesday lunch &  I thought it was empty until I saw a full patioMy friends and I went for the restaurant week deal and we got:- chicken liver pate: one of their best appetizers by far, the whole grain mustard, marmalade & the cut of bread gave a carnival of flavors in my mouth! It made me eager to try the rest of the deal- fries & 3 dips : The fries were nothing special. The basil aioli was light and refreshing but could have used a bit of parmesan or salt. The old bay aioli could have used a lot more seasoning as well. The last dip was ketchup- fried chicken po'boy: really more of a fried chicken sandwich, surprised it came on a brioche. Buns were toasted though and it was a great bread to soak up the flavor but that leads me to the next part: it had no flavor.  The texture & cook were perfect but the juicy chicken had no seasoning, and the slaw was lacking (could have used more). I was putting the trio dips on my sandwich to compensate but it was not enough. I get that this place is more focused on healthy clean food but there are ways to incorporate more flavors!This is an amazing place to dine at but it failed to deliver on flavor. I am willing to come back another day to try the rest of the menu but I left feeling very dissapointed",281,1437,116
"Had a reservation for 2 on a Sunday night at 5:30, plenty of space, so I was seated immediately. The space has a really nice dimmed lighting, creating a great intimate space for small groups. Ordered the broccoli rapini, flavor was great but a bit salty and extremely oily. Asked for half vegan cheese on the pizza and they accommodated! It was really good, crispy and thin crust just how I like it! Managed to finish all of it with 2 people. Although I just realized that the arugula we ordered did not get added on top of the pizza and I forgot to mention it since we were so hungry! Regardless it was a pleasant experience and appreciated them for catering to my sensitive stomach!",126,684,54
"Came here for a casual 3 person brunch on a Thursday and loved everything we ordered! We were seated outdoors immediately and loved the ambiance of the front outdoor area + the heaters overhead. The portions were huge, especially the fried chicken and French toast, which I only finished half of and took the rest home to eat later. The french toast was so spongey and not too sweet, which paired perfectly with the crispness of the chicken. I got the lychee cocktail which was very sweet and delicious! Id recommend getting the fries because they had three great dipping sauces.",101,579,41
"Cool space, but I was a little disappointed in the food. Is was fine but nothing amazing. Not worth the price in my opinion. Service was good but they forgot to bring us a drink that they ultimately charged us for.",41,214,17
"Came for dinner with a group of friends and we shared a few dishes! We started with fried, pate and cauliflower. It was all sooo delicious and loved how unique the food was.For mains, we shared two pizzas that were both amazing! It was just enough food for the 5 of us where we were satisfied but think we could have eaten one more large dish like a pizza to be properly full",73,375,34
"Dinner before a movie brought us to Starbelly for an early dinner. We were seated inside at a high-table. Started with the chicken liver pate. It was good but somehow it lacked flavor!! I am a Pate lover and it just didn't leave the greatest impression. My salad was good, and my husband enjoyed his burger. The burger and salad were both in the small side!!  Entrees tasted good but nothing was a standout.",74,407,32
Came here after doing Barry's Bootcamp so this was super conveniently close and lots of reservations were available. Good:- Loved the cauliflower soup - so much flavor packed into each bowl- Fan of the Star bacon pizza - I liked the tomato sauce and bacon combo and it was good even though I'm not usually a fan of arugula - I liked the loco moco - definitely on the smaller side but the medium rare loco moco was tasty and left me wanting more - The freshly squeezed orange juice was heavenly - started drinking it and couldn't stop! - Upscale modern ambiance Bad: - The butternut squash didn't work as well for me - I didn't like the combo of flavors very much and the cheese didn't really sit right for me either Overall very high quality place and great for dates - we came for a double date and would come back - reasonable prices too.,158,840,56
"3.5 STARS- the storefront makes the restaurant seem deceptively small, but once inside you can see just how much seating there is, as well as in the backyard patio- the interior is really cute and the ambiance is nice, lots of conversation and noise- we went on a tuesday for lunch and though the outdoor and indoor seating were empty, the patio was pretty full- my friends and i went for the restaurant week deal and we got:- chicken liver pate (5/5): this was the best dish we got! the pate was creamy and flavorful, the bread was thick cut, perfectly grilled, and crusty, and the whole grain mustard and caramelized onion jam combined with everything to make the perfect bite. unfortunately this also raised our expectations for the other dishes a little too high- fries+trio of dips (2/5): the fries were nothing special, my friend said if you told him they were in-n-out fries he wouldn't have questioned it. the basil aioli was light and refreshing, but lacked flavor. the old bay aioli didn't taste like anything. the only solid dip was the ketchup :/- fried chicken po'boy (3/5): really more of a fried chicken sandwich, as it didn't come on french bread but regular buns. the buns were toasted well and super light and fluffy though! the chicken was fried really well and moist BUT it didn't taste like anything. i dont think the breading was seasoned, there wasn't enough sauce, and the cabbage/jalapenos didn't add any flavor or moistness, so it ended up being kind of dry and tasteless overall. i ended up adding the dips to the sandwich to try to add some moisture and flavor. also, we saw that the sandwiches that were brought out to others sitting near us looked fuller than ours which was somewhat disappointing. - overall this place is super cute and had a lot of potential, but sadly did not deliver on flavor for the majority of their dishes. i might come back to try their other dishes though just because the ambiance and pate were really good.",348,1965,158
"Cute restaurant in the Castro, close to the intersection of Noe Valley. They serve standard American fare - think burgers on thick buns and trendy appetizers like white bean dip and salads with goat cheese. There's a lovely covered outdoor patio which usually fills up quickly for brunch and dinner. They have a happy hour that ends at 6 PM, I highly recommend getting there at 5 PM and having cocktails and appetizers. Weeknights and weekend mornings fill up pretty quickly. Service is a bit slow, but staff is extremely friendly and it's easy to flag someone down. The food is good all 'round -- for dinner, we have tried everything from the halibut to the pasta to the burgers. The rice pudding with cherries for dessert is a nice happy ending :D",133,749,47
The service was absolutely amazing and the food was even better! Loved the crafted cocktails too! This absolutely was a great vibe and can't wait to come back again!,29,165,9
"This place was truly amazing but went downhill in the past year. The prices are very high and the food, while good doesn't justify the cost per portion if you consider the size. The pizza was also mediocre last time we had it and contained a random date pit. We used to come here every few weeks and we are not going to come back in the near future.",69,349,30
Easy to get a table for Sunday brunch. There is parklet seating and a huge backyard seating for outdoors then inside tables and a bar as well.Chilaquiles were a good portion and tasty. Would have been better with more spice or a salsa. Side salad was mildly dressed and nice to have greens with the meal.Lychee cocktail was pleasant but I wish there was more flavor to it. Lychee itself was light and overpowered by the lemon. Definitely a lot of create cocktails I look forward to trying in the future,91,502,42
"We came here for my coworkers bday, and it was great vibes all around.We ordered a lot, and we spent $89/person for about 13 people. We ordered hella appetizers, including fries and more but I ordered the burger, which was very solid with the melted cheese.Would def come back and try ordering less because I was just too stuffed",59,329,26
"Good food and good service. My friends and I had the following food: - Starbelly salad - delicious and refreshing- Fresh spaghetti with bacon - great and tasty. Pasta was perfectly al dente.- Crab rangoon squid ink pasta - delicious and VERY flavorful, with lots of crab meat! - Salty pup grapefruit drink (with gin, elderflower, fresh grapefruit) - refreshing and sweet- Cucumber basil limeade drink - too sour/bitter- Warm beets & goat cheese - good, soft, and warm- Crispy fried brussels sprouts - good - Puree of carrot and celery root soup - thick, creamy, and tasty. Curry spiced pears added a unique twist to the soup flavor",109,631,20
"Seriously great food here. Servers were delightful even with such an insane brunch rush. It's a shame I didn't get my servers name he was so lovely and kind with us!!! Otherwise I would shout him out on here. I ordered the corn pizza as corn and cheese a pretty popular asian food combo and I am usually attuned to the taste of my culture  it did have some latin American flavor twist to it with the sauce which was some sort of aioli. I will say it was a tad bit greasy, but hey its a pizza. Italian and oil goes hand in hand. My other friend got the French toast with fantastic toppings with something alike to a blueberry preservative, some nutty seeds and a MASCARPONE. Will say the MASCARPONE I have tried on other french toasts before were a bit more whipped, light and fluffy. This one was a bit more thick and more of a regular cream cheese consistency. Not mad though, it balanced the flavors very well but my friend wasnt a huge fan. My other friend accompanying me ordered the Loco Moco. I also found it peculiar that there seems to be an Asian cuisine twist on this traditionally Latin dish. I tasted a bit of it and it mightve been the best thing on the table. It had a perfectly season sunny side up egg, a hamburger patty cooked about medium rare, over some rice. there was a bit of dehydrated fried onions as well as fresh cut green onions garnishing the egg, and topped off with a soy GLAZE! not soy sauce... a GLAZE! i need the recipe for this supposed glaze cuz it was amazing. I don't even rlly like red meats that much or eat them on the regular, so it was very shocking to me how the flavors were very balanced. Very cute seating, we sat indoors but there is a very nice patio and a bar too.",329,1713,147
"Came for an early Sunday brunch, easily secured a table for 2 around 11am but the place definitely seems to fill up as time goes by.The inside is real nice, spacious and bright. There is a patio where you can sit with your dog, as well as seats in the front. Inside was fine, although it got pretty loud once more people arrived adjacent to our table.The menu isn't as expensive as other brunch spots, but still has some fun stuff on it. Win! I got the Chilaquiles and a coffee, my vegetarian companion got the Italian eggs with a side of fruit. I didn't see any fancier coffee options, so I would double check with them if that's what you're into.The food was solid - good, but not mind blowing. It hit the spot for a casual brunch. What lacked -the chilaquiles, while tasty, felt a bit one note and could have used some more heat or zest. House made chorizo didn't stand out that much, I guess. The fruit side was a bit worse for wear, although I understand it's not the season for lots of brunch fruit. I am lowkey suspecting my coffee might have been part decaf, or maybe it was watered down? Didn't feel very strong. Maybe will go for some alcohol next time instead.Again, good for casual brunch - I wouldn't bring a foodie with expectations, but great vibes, friendly prices (for SF) and ambience if you're getting brunch to be social.",248,1341,97
"Pretty noisy and a tad pricey, but a good place to meet up for lunch in the Castro. The pizzas and little gem salad don't take a big bite out of your wallet.",33,157,15
"Everything was great. Ordered the mussels, broccolini, and a clam pizza, split between a friend and I. All together, it was delicious. The clam pizza didn't have too much flavor but the sauce the mussels were cooked in was the right addition to drag a slice of pizza through to make it more enjoyable. The broccolini was delish, def add it to your order.The waiter and ambiance of the restaurant were nice. We sat outside in a covered area which I believe was heated too so it was comfy even on a cold night. Service was quick but they weren't pesty about checking in. Drink-wise, my friend had a tasty passion fruit cocktail and I ordered an NA IPA beer which would do the job if you need an NA beer to enjoy.",133,710,61
"Love the food, service and ambience.  Bar program has some excellent street cred! Great neighborhood restaurant -- their chicken liver paté is super d.",24,151,6
"My friend took me out for my birthday here. Ambiance was cute. We both ordered their burger. I was totally disappointed. The meat was very dry and blend and the bun was cold, the bacon was too dry as well had had bo taste. The burger was not cheap so I would expect a very good quality if I'm paying that price fir a burger. The fries was not hot neither. Service by the young girl was 5 star food did not meat the mark. Only reason I'm giving 3 stars is for our server. Do better food Starbelly!",99,496,39
"Came here for SF Restaurant Week 2022! The lunch comes with a starter and an entree for $15! What a DEAL. I ordered the 1/2 liver pate plate and chicken po'boy. The pate was a great deal - it came with a toasted piece of bread, pate, jam, and mustard. I should have ordered another slice of bread! The chicken po'boy was a good size and chicken had a tasty flavor but the slaw was a little bitter to me! Stop a great meal for $15!",86,430,32
"I actually love Starbelly.  The reservations are easy to make and the food is yummy.  The ambiance is nice- elevated casual and the service is very friendly.  Parking is a bit of a pain in the Castro if you don't get dropped off by Lyft. DINNERPate- delicious.  Not all people are into pate, but if you are- you have to try itCrispy fried brussel sproutsFresh spaghetti- The spaghetti is my favorite dish herePizza margheritaAll in all, the portions are on the smaller side.  I don't have a super large appetite, but I feel like I still leave here on the hungry.  I've only come for dinner, but I think this is better known for brunch.",115,635,50
Ambiance is really great. Food is good and well-priced. Recommend sharing and getting pizzas. Service is great and food is always timely.,22,137,7
"Maybe I'm just not a fan of New American food or I'm a snobby San Francisco foodie now. But I feel like the standard for pizza and hamburgers are pretty high in the city. The food wasn't bad but it didn't do anything for me, tasted like something was missing. Or maybe just tasted too healthy so it was stripped of its debaucherous origins. This place seems really popular though so maybe the secret is to down a few cocktails first to ""loosen"" up your tastebuds. Maybe that was our mistake but its safe to say that the food was not the star of the show (babdum tsk)",108,566,49
"A little hit or miss, but staple of the neighborhood and the right choice most of the time.  Great atmosphere, including the Parklet and sidewalk seating but hope the service has improved. Food is good, and the price is reasonable, but don't go if you're pressed for time",48,271,23
"A very unremarkable brunch! Not bad, but not great, so a solid 3. The marguerita pizza was hard on the bottom and chewy on top. The chicken and waffles was just fine, the chicken was pretty crispy on the outside. I enjoyed the salty dog cocktail. Nice elderflower flavor comes through and pairs well w/ the gin and grapefruit. The tea for two was bitter, would not reorder. Service was good. There is seating on the front and back patio, and inside in the main dining area.",87,473,33
"Walked in here to get brunch on a Sunday, and ended up waiting for about half an hour, which was decent given the popularity of this place.We ordered a couple cocktails to begin with, and they came out p quick. Taste was a solid 7/10 on both.Next we got the fish tacos, french toast and a dish called the loco moco, which is essentially a beef patty topped with a runny egg.The fish tacos were crunchy, fatty, and made helluva brunch. The french toast tasted super satisfying, but the amount of calories on that plate, my god. The loco moco was a good balance, and the patty was cooked as I had asked for, the egg had a nice mouthfeel, and the rice made it a complete dish.The portion sizes on each was good, and is enough for an adult, unless you go splitsies. The waitstaff was warm and the ambience was very welcoming. Definitely a go-go!10/10 would go back again!",161,867,69
"Mission Fig Pizza: figs, arugula, serrano ham and manchego cheese. Pretty good but just a little dry. Could've used some balsamic glaze or something. Chicken and waffles: chicken was just okayLoco Moco: one of the highlights of the meal but also small portionedPo Boy: loved the fries, slaw was good, chicken was okay Honestly thought the food was just okay, nothing super memorable. I liked the pizza the most but honestly wish there was a glaze on it because it was kind of dry.Service: sitting outside, we had a hard time getting the server's attention. Reservations: super easy to make through YelpDrinks: mimosas with grapefruit or orange juice, nice and refreshing",111,670,42
"Solid food, good atmosphere and fast service. Friendly, down home feel. Highly recommend.",13,89,2
