review,word count,char count,stopword count
"I came here with a friend recently, due to his suggestion. I guess when you grab food and drinks with a queer couple, the Castro is a must. =) Not complaining at all!Thankfully, they wanted to share foods so I got a variety of tastes. My friend upsold the pate, insisting we had to get it and that it was delicious. I was worried, because when people gush about something it often leads to failure. This. DID NOT DISAPPOINT. The pate is soooo BOMB. Get it. We had a mix of stuff so the quick and dirty.Persimmon salad: Fresh, properly dressed, and delicious.Brussels: A little oily but flavorful and crispy. Pizza: Just solid. Not special, but if you want a pizza here it'll do.Steak: Nicely cooked, nicely seasoned. Somehow a giant order of fries appeared at our table too. And the sauces were delicious. Utterly delicious. What brings it to a 4 rather than a 5 for me. The service was good overall, their manager got his hands dirty and helped serve our table as well.  But they were very clear that we had to leave by 8 because of a reservation. We didn't mind...but then they sat a table of 2 next to us at the communal table and those guys said they were not a reservation of more. So...why did they hurry us out? It felt really weird. Don't take it as a total negative though. I'm sure if I made a reservation and came here again, everything would feel and taste 100% how amazing restaurants are and should be. This place is awesome and you should definitely try.",271,1469,111
"Been coming to this place for years. Was my go-to place for takeout at the start of the pandemic. Highly recommend the Dr.'s Orders cocktail. Food is consistently good, and it's one of the few places in the area open for later dinners.",43,235,19
"I like this place. The food is always tasty and the atmosphere is fun.  Staff is friendly and they keep things moving pretty fast, never too long of a wait. Sometimes it's pretty crowded but that's understandable because it's a good place so it makes sense it's popular.",48,270,19
Got the French toast and it was pretty good. My friend actually picked this up and brought it all the way to hayward and it was still warm!,28,139,14
"I was with my godson and his parents celebrating the upcoming Christmas Holiday. He and I both had the most delicious chicken, waffles with maple syrup that we've ever enjoyed. The chicken was crispy and not greasy, fried to perfection. The waffles were light, fluffy and oh so yummy with warm maple syrup. I am looking forward to my return visit. I should try something else, but will probably have the chicken and waffles again because they were that good.",80,458,35
"The setting is lovely for a Covid meal. They have retractable awnings and heat lamps. Not freezing through a meal was awesome. They welcomed us to a table at 4:30 with notice that there were 5 reservations. When I made reservations it said nothing about a 30 minute window. They fortunately didn't boots us out. We did not ask about dessert. The foods was 2/3 enchanting. Corn soup, delicious. Fried chicken po' boy light crispy and delicious with a mild jalapeño slaw. The problem was the salad. The vinegar over powered any flavor. I'm sure they will adjust making their salads delicious. Both the side salad and entree salad had the same issue.",113,647,38
"Came here around 10:30am on a Sunday. It wasn't super busy- but since we didn't make a reservation we could only sit outside or at the bar. We chose outside since they said they turned on the heaters, but I still thought it was cold. We shared the Sunnyside Joe's ($13)- which was ground beer, cheddar, spinach, and potatoes. I absolutely LOVED the potatoes. They were so crispy and delicious- I wish there were a few more. The eggs were definitely way over cooked- there was no drippy yolk and the beef didn't have a ton of flavor, but with the cheese it tasted better.We also got the Challah French Toast ($14)- It came with mascarpone, peaches, and pistachios. This was soooo good, I loved the combination! While it was a bit dry around the edges, the middle was quite yummy and not overly sweet. Presentation was also beautiful. It nicely complemented the savoriness of the other dish. I didn't think it was going to be enough food for the two of us, but after we were finished, we were definitely comfortably full. The service was a bit slow and it took a bit longer to get our food (I think they forgot about us outside!).",206,1128,88
Always a reliable place for solid food and nice staff that make you feel comfortable and appreciated,17,100,6
Excellent food. Best burger in the Castro. Pizzas are great too. Fun ambiance and cocktails. Reservations are recommended although they do have a communal table by the bar that is sometimes available at short notice.,35,216,14
"I really enjoyed my meal here. My friend who lives in SF picked it up on her way to visit so I had to warm up by the time she got here, which was to be expected (I now really appreciate eating food in-person so much more). I went w/the french toast and fried chicken combo. I hadn't had either in such a long time, so decided to go w/that as my entree. I was not let down--really buttery french toast (I should have asked for more syrup, you only get a small container on the side) and crispy on the outside/juicy on the inside fried chicken. Decent sized portion for a takeout item too. I would definitely like to try the other dishes and cocktails whenever I can actually make it into this establishment.",135,706,57
"This was my second time at Starbelly. I don't really remember my first time (it was a larger dinner party), so this review is based off my recent experience. We came here on a Saturday at around 3PM. There was 6 of us, and we loved everything about our meal. We ordered drinks, and we all loved our drinks! Our server even gave my girl a tequila shot (we were brunching after wedding dress shopping).As for the meal, every thing was excellent! We had:Brussel sprouts- 5/5 this was sooo good. Crispy and sweet. We didn't realize it had bacon, so my vegetarian friend couldn't eat this. But for a meat eater, these brussels were perfect! Elote pizza- 4.5/5 I loved this! We ordered 3 pizzas, and only ate 2. They are massive, I would definitely share this among 2-3 people. Loved the sweet corn, and the sauce on top was sooo good. Tasted like some kind of aioliFries-5/5 these tasted like those double fried fries they have in Belgium. Soooo crispy and the sauces were good. I think it was pesto aioli, house made ketchup, and chipotle sauce. All of them were good, but I loved the pesto! Butternut squash ravioli- 5/5 this was my favorite thing I had! It was cooked in brown butter & fried sage. Sooooo flavorful. The raviolis themselves almost tasted like dumplings. I loved the textureChicken pate- 3.5/5 this was my first time having pate. I don't know what good pate is, but I wasn't the hugest fan. I did like the grilled bread tho, it was blackened and delicious. They're doing a good job with covid, social distancing and m, and ask that when the servers come you put on your mask!",288,1588,105
"Visited on Saturday night and wasn't seated right away - no problem. Didn't see anyone at the table for a while - but busy - no problem.  When they took our order we were specific we didn't want everything to come out all at once.  It came out literally backwards - drinks came out last and we hadn't eaten the appetizer before the pizza was there and it did not taste great cold - WTF?!  No one came by to check on us until we were done, and when I asked for a togo box they wanted me to jam 2/3 of a pizza in a small to-go box.  The food has slipped and the severe is crap.  We won't be back again soon.",124,605,59
"A decent experience for dinner. Everything we tried, whether the little gems, the chorizo pizza, or the fried chicken, was OK enough, although not necessarily mind-blowing. Just OK. The fried chicken, in particular, was a tad too fried.Perhaps the strongest point was the service; the staff were generally attentive, courteous, and professional. The venue itself is also larger than it appears at first glance thanks to a nice outdoor patio in the rear with a sturdy-enough tarp to hold up well even on a particularly rainy and windy day recently. Not a bad choice overall.",95,573,35
"I was really excited to come back to Starbelly, but was disappointed during this most recent visit. I think the food was 3.5 stars but with the lackluster service I'm giving it 3 stars. Hoping it was just an off night for them. The charbroiled mussels looked visually spectacular but the mussels were not fresh at all, to the point where they weren't pleasant to eat and we left the plate unfinished. It's probably the only time in my life I didn't finish a plate of mussels as appetizers.The Grilled Bavette steak was rubbery. It's a cut of flank steak so I was expecting it to be tougher, but not to this extent. It was also flavorless, which I wasn't expecting. The vegetables with this dish lacked any flavor. Chicken Liver Pate saved the day, and as other reviews have indicated, simply incredible. Great flavor and just delicious with the marmalade and mustard over bread.Starbelly bacon pizza. Pretty solid. Bacon was really good. The tomato sauce is excellent.",168,968,73
I had the recommended chicken sandwich. It was delicious. Friends let me try their pizza. Everything was an absolute delight. Drinks were good too. Would recommend to anyone.,28,174,9
"Oh Starbelly;  how my belly wasn't full, nor did I think this was a 4 star experience.Started off with the fresh and super bitter orange juice. Skip it.Pizza was so bland, and had so little cheese I thought maybe they thought we were lactose intolerant. I mean, a Margarita pizza is supposed to have cheesy goodness--not bland crust and dry sauce.The mushroom pizza was only slightly better,  only because it had mushrooms, but once again it was lacking cheese and sauce.The next meal was catfish which was so ""blackened"" no one ate it. Dry and burnt, but sure, call it blackened if you want.The steak was chewy, and the desserts were plain. The butterscotch pudding also had a weird flavor to it so no one took another bite and the Chocolate cake was dry and cold.For our Christmas work dinner,  this place was a disappointment.",145,829,65
"Great little place in the Castro with indoor and outdoor dining. Good variety of food and wonderful, friendly service. Outdoor seating has heaters and indoors has tables and bars with a back and front patio. The cocktails are fun, but very sweet. Had the Otro Diablo tonight but have tried their marg and the salty dog. Corn pizza is really tasty as is their cornbread! Would recommend for food and drink night out, but don't go if you're expecting to have just good cocktails.",84,477,35
"Friendly staff, they have outdoor seating in the front and back. Baby friendly (I recommend the back). The pate and mussels are amazing!",23,136,8
"Nice back patio! It was shaded and had pretty plants. And because it was fully surrounded, there was no wind. I don't know about you, but since the pandemic one of my main criteria for selecting a restaurant is the quality of the outdoor seating.Great menu. I really enjoyed my Mediterranean platter. Be sure to make a reservation; this place is popular.",62,354,26
"The fries are delicious, salty and crispy, but the best part is the toffee cake! It was so soft and the caramel was so rich.",25,124,12
"Was a little disappointed for a few reasons but one in particular. We booked reservations for restaurant week and while other restaurants seem to honor the menus weekday and weekend, this place didn't (which isn't a bad thing), but it also didn't note it on the restaurant week site and we booked our reservations through there. What was supposed to be a really good deal for lunch $15 ended up being way more for way less since we had try things off the regular brunch menu. We were told when we got there and apparently a few others around us ran into the same issue. Anyway,Ordered:-chilaquiles which was tasty however there were so many jalapeños (not spicy) but I didn't order a jalapeño chilaquiles and that seemed to be the primary ingredient after the chips. -chicken sandwich that was on restaurant week menu but $10 on its own.  The chicken was a bit dry to be honest and really thin. One side/edge of it was completely crunch batter without much chicken -the mushroom pizza we substituted white sauce with red and was asked if we wanted arugula. We shouldn't have made the assumption but it sounded like it was included but they charge $2 for it. Overall pizza was okay. Mushrooms were good and gruyere cheese added a nice kick but the pizza was soggy I couldn't lift it up form the crust side without all the toppings sliding off. Restaurant ambiance is nice and cute though with indoor, outdoor, and communal tables.",253,1429,112
"(3.5 stars) Perfect spot for dinner with some friends. The back patio is wonderfully cozy with heat lamps, plenty of space, and peaceful decor. The food is very solid aside from the French fries which were disappointingly thin and unseasoned, though the sauces were a unique twist--with the green one being the standout. Loved the broccolini and the white bean dip, both great for sharing. Struggled to choose a main but landed on the chorizo and egg pizza. I normally love a runny egg on anything, but it actually was a bit overwhelming here since each egg landed on its own slice. The chorizo had some kick to it though and went really nicely on its own with the cheese and thick crust.",123,688,53
"Great cocktails, Mexican Coke if you feel like a soft drink at lunch. Wonderful, competent, friendly service.Ordered a hamburger with cheddar and fries. Delicious! Best fries ever . At first I thought that $23.00 (plus tip) was a bit pricey, but it was so generous that I got lunch and dinner out of it. Fries were even good cold. So glad they're in my 'hood.",65,359,21
"Came here for sf restaurant week (late review yes i know), and it definitely gave me a reason to come back. My friend and I made reservations on a Tuesday afternoon for lunch - place wasn't packed but definitely wasn't anywhere close to empty either. There's an indoor and outdoor seating area in the back, and I'd highly recommend outdoor if the weather is nice.We ordered the chicken liver pate to start, mediterranean plate and fried chicken sandwich for entrees, and a creme-brulee like dessert. The pate was my favorite part of the meal, honestly I'd go back just for that. Definitely get it if it's on the menu when you go! The smaller version is available during happy hour, and the larger version is available during dinner.pro-tip: u:dessert story is a close walk away if you're craving something sweet afterwards",141,822,53
"Starbelly has been doing restaurant week for awhile now but is only doing M-F for spring 2022.  We came on a weekend brunch around 1pm on Saturday the place was packed but not full.  We ordered Italian Eggs and Sunnyside Joes per the server's recommendation.  Both dishes were great, not huge portion but the food filled me up.  Because it is comfort food, the food is a little more on the oily and saltier side than the normal yogurt and salads.  The price is good for the location and what you get, I would definitely recommend this place.",98,541,43
"This place used to be good many moons ago, but sadly it's slipped way down. Starbelly was sort of hanging on even before Covid where the food was just OK and the service was underwhelming. One would think after being forced to close and revamp after a pandemic that a business would came back as a shooting star and grateful to be making money again. Nope! Still mediocre food and horrendous service that's not fit for roadside diner. Doesn't seem that these ""too cool for school"" kids will get it together any time soon. Time for a change or ownership.**always get a good laugh when the establishment responds with a wannabe witty response for all to see. How about offering to make it up to the paying customers that spend their good money that pays YOUR bills Adam T? Same customers that take the time to write a post and oh gee, I don't know, offer to send them a gift card or refund? TBH why would I ever want to return to have a bunch of smug losers ""make it up"" to me? If you were such a great joint, it wouldn't have happened in the first place. It's called business 101. Perhaps an enema of the staff would be a start. And agreed Adam T. I've had some stellar service at roadside diners and some pretty bottom of the barrel terrible service too and what I experienced at Starbelly was worse than any of those.",247,1318,104
I love the pizza here and the sauce and bacon were tasty. Also draft beer was nice. Very crowded,19,96,7
Food is good. Service is amazing. Outdoor seating is really cute! Bathroom is clean lol.,15,88,4
"Very disappointed w the service. Came w w group for my fiancé's birthday. Drinks always came after food, for 2 rounds, and worst part: told waitress about the birthday occasion and she said they can put a birthday candle on a desert. And She forgot. Desert Came. She later came and Said: ""Oops"". Surprise?! Bad enough you forgot the candle but who are you to come and tell the surprise? And totally talked like you didn't give a shit.  You just messed up the surprise. Maybe at least try to make it right? Come w another dessert w a candle? Or comp the cheap dessert?Foods always not that great for SF, very average.",113,616,40
"Came here this previous Sunday for brunch. We (my cousin, his girlfriend, and I) were going to check out The Mint that day for the free historical day slash the free day at the Asian Art Museum.. so before that..So he made a reservation for 2pm for us and my boyfriend. And requested for the patio outside.The patio is gorgeous and has an open top, but gets enclosed when it rains which there was a chance that it would, but it was still bright and cheery out there. The food was great. And I would highly recommend my dish:chilaquiles, house made chorizo, corn chips, chile sauce, cilantro cilantro, guacamole & house salad ^ only complaint is there wasn't enough chorizo bits at all. Otherwise flavors and textures were all great.",130,732,52
"Went to Starbelly because I was in the Castro for Lesbians Who Tech Summit. I must say...This place was definitely the spot to have a nice meal for lunch during a full day of keynotes and break out sessions. I didn't take a picture of the food but I had the French toast & fried chicken dish, and literally everything else my coworkers had; like the Starbelly salad and the loco moco looked delicious too!! Ill definitely be back. They take reservations as well. Highly recommend checking it out if you're in the Castro and want o eat somewhere that will leave you satisfied full. I was able to meet Stacey Abrams as she too was having lunch at Starbelly. If Stacey Abram and I both approve, it's totally worth checking out !",133,725,54
"Another weekend brunch restaurant checked! Starbelly is located near 16th St. Station BART/Castro so just know that parking in this area is not the best. Starbelly gets pretty packed on weekends so I would recommend making a reservation on Opentable. I made a 10AM reservation for 2 people a week in advance from when I wanted to go and I had no issues.  The place itself is super cute with nice wooden interior and a back patio area with heat lamps to keep you warm even when it's pouring outside. I got the sunnyside joes ($12) and the dish was tasty! The dish comes with some beef on the bottom mixed in with some onions, spinach, and cheddar cheese with two eggs nicely baked on top. It was a nice savory option without making me feel too guilty about what I was eating. The potatoes they had on the side were seasoned well and had a nice crisp to offset the egg portion of the dish. The only con I felt with the dish was that it got a little too runny/watery.If you want something refreshing on the side to pair with your dish the ginger/lemon soda and lavender lemonade are divine!",202,1087,83
"When Starbelly opened its doors years ago in the Castro, people flocked here for their luscious pizza flavors and the fries with trio of dips.I definitely slacked off my yelper duties and never been here until recently for my birthday brunch. We wanted something casual and won't break the bank. We ordered several pizzas, entrees, drinks and even got charged for the cake we brought in, and each person from our group of 8 (minus me!) only spent $42 with tip. Whoa,  brunch is the way to go! From eggciting egg dishes, fresh salads, pizza, sandwiches and a few essential sides you can't live without, the brunch offerings satisfied the group. I had a delicious gazpacho style tomato soup and Italian eggs cooked in cast iron skillet with zucchini and peppers served with thick rustic bread. My friends got the chicken and waffles (so good!), challah French toast (sweet breakfast treat), Prather Ranch Burger (hefty!) and chilaquiles with House made chorizo. We ordered several pizzas and even if you get the very basic pizza margherita ($12) and add toppings like we did, you still will be in the $17-$18 range. (Screw Zero Zero where our pizza cost $25 for mediocre toppings!) the most interesting flavor combination was the roasted corn, white cheddar, Aleppo chili pizza with lime aioli, it was easily the crowd favorite! The wild mushroom pizza with pickled onions was also good. The pizza crusts are soft and pliable, although thicker than a Neapolitan style one.There were some miscommunication when the staff sliced our cake (we didn't want the whole cake sliced, but rather small portions) but they were apologetic for the mistake. Our servers were reliable and took great care of the group. As I get ""wiser"" (older? Lol) I tend to shy away from the super big, boisterous birthday parties. Starbelly let me celebrate another year of life with fabulous food and drinks in a neighborhood atmosphere and I couldn't have asked for more.",328,1942,111
"I'm at the stage of life where catching up with a few old college friends involves finding a place that can seat nine adults and six infants / toddlers - not an easy feat in SF.  My sister made the great recommendation of Starbelly.  It really lives up to its website's description as a ""casual and friendly neighborhood restaurant"".  I was easily able to make a large group reservation on the crowd-friendly covered patio.  The California comfort food cuisine made it easy to share plates, the wine and beer selection is good, and the cocktails are creative.  The bright, warm decor is as welcoming as the service.  The narrower interior would be great for smaller parties that want to avoid the chatter of the patio, but I found the noise level to be perfect: enough background noise to mask when the kids fussed but not loud enough to make conversation hard.",151,861,57
The pizza was awesome. Delicious sparkling rose too! Menu had lots I'd like to try. Will return!,17,96,3
"Really quaint little gem on 16th just off Market St and about 5 mins walk from the Castro muni.Nice hip interior, including an outside enclosed patio and a long bar with counter space to eat. A long communal table with tall chairs, kinda heavy to move but doable.  Booked this table to enjoy the 3 course lunch offered for the SF dining week, turns out it was not offered on weekends, too bad.  However, we still had a good lunch.  The chicken waffle was really good, nice crisp and flavorful $16, the loco moco $11 was simple and tasty, perfect for someone with a small appetite.  Fries with dips $7 are always good, kinda reminded of the fires in In and Out burgers. Most likely will return to try out other items on the menu.",135,728,49
"Starbelly is a cute American restaurant in Castro. I went for brunch, and the restaurant itself is cute and spins on classics. The oyster pizza (discontinued??) was not very oyster focused, more of a cheese flavor with some oyster. A good pizza, but not what I expected at all. The drink was really good and the strawberry really came through without being too sweet. I liked this place for a cute casual lunch, but not amazing.",76,428,33
"I've gone to this place a couple times for drinks and for brunch. The cocktails are very good but the place closes a bit early so not really a bar. At brunch, my group got the yogurt with fruit, french toast, and butternut squash pizza. All were good, especially the yogurt!",51,274,20
"Food is great, love the decor.I have been to Starbelly a handful of times, but last 2 times it was an unwelcome experience. Did not want to write a review after the 1st time, but it feels like a pattern now. Back in November, I reserved a table for 2 for my friend's birthday. We only learned about time limit once we came to the restaurant, but did not have much of a problem with an hour and a half dining. Our order was taken in a timely manner, but food took around 30 min and not the whole order arrived. The waiter forgot about our drinks, and we only got them when we had 20 min left. When he brought the drinks, we asked if we get more fries. He said it is too late, and just brought us a check. The whole experience felt so rushed and we felt uncomfortable. Today, I reserved a table for 4 for my family. We were seated at the patio, and the whole area was very empty, only one more table had people. We were set right in the spot were it was extremely windy. The wind was blowing away the warmth from the closest heater. We were asked if we could be set in any of the 4 tables by the wall or in the parklet. I am still not 100% why we could not have been moved to a different table, the waiter said those tables are ""on tab two"" (whatever that means). So we just left without ordering. The food is great, but I'm definitely not coming back.",269,1350,126
