review,word count,char count,stopword count
"I wanted to love Starbelly so badly on a wonderful recommendation from my friend but I would have to say my food experience here was mediocre. The cheddar cheese grit sticks were an interesting spin on polenta I suppose - gooey and soft on the inside and fried to a crisp on the outside. These were an interesting item on the menu.My friend swore by the pate, which was pretty good but nothing to drive home about. The bread was thick and crusty with a standard chicken liver spread that is quite classy for a date night. The pizzas here are pretty unique and deliciously crafted. As someone spoiled by NYC pizza, I would give the Starbelly pizza around a 3.75 out of 5, which is pretty good. We got the unique roasted corn, white cheddar, Aleppo chile, cilantro & lime aioli one. It has a cool Mexican spin with the sweet corn mixed in the cheese. I got a prickly pear cocktail, which was a pretty good as well. Overall, I would say Starbelly has decent new American fare, with a west coast Hispanic influence.",186,1011,66
"Loved it! Came here with 4 people on Sunday evening and the vibe was amazing, we sat on the patio and really enjoyed it. We got the flatbread and white beans for an appetizer and it was super creamy and a nice way to start off the meal. Non-alcoholic drinks were also on point and fair-priced too. We also got Margherita Pizza, the burger, and spaghetti - all of which we enjoyed a lot. It was a great time! I want to try brunch here.",85,434,35
"I have have eaten at this place a handful of time and every time I was disappointed.  Today was the worst of them all.  The host up front was so RUDE and dismissive.  After waiting for almost 10 minutes to be greater he shouted ""WAIT"" from across the room as if I haven't been standing there this whole time.  In addition when he finally handed me my food, he basically threw it at me.  The food was okay at best.  Chicken was not fully cooked or cut on the salad.  Portion was small.  I'm never coming back here again.  The owner should really evaluate their stuff because they are killing the business!",112,604,50
This place was pretty good. Their sweet potato soup was mildly disappointing as it was a little bland. Loved their catfish and risotto though. The bartenders were friendly. The drinks were strong AF.,33,199,10
"The perfect spot for a boozy brunch.  This might be the best red sangria that I've ever had.   Usually when you order sangria, it's so watered down that you wonder if you've had a drink.  One of these and you're not fit to drive.  Two and you're ready to bar hop in the Castro.  Great heated outdoor patio.  Fun crowd.  Friendly and attentive staff.  What we ordered: Loco moco medium rare with side of avocado Rounds and rounds of red sangria Side of friesCheers!",85,464,34
"A great place for brunch with a group! Came here with a group of 6, definitely recommend making a reservation in advance if possible. We were seated right when we got there, and I requested to be seated on the patio which we did get! The patio is great--it's covered everywhere but natural light does come in. It's a good size and perfect for brunch.Service was good! The only slight downfall was that one of the dishes came out much sooner than the others, which can be hard when waiting for a group.  Food was great though, I ended up splitting the chilaquiles and roasted corn pizza--the corn pizza was something that was brought back to the menu and it was delicious! Chilaquiles were good too, and came with a side salad with goat cheese.They do not have bottomless mimosas but they do have a menu of other drinks including mimosas. Would recommend!",153,854,69
"New favorite spot!!! Went here for brunch and fell in love. Place is so cute, friendly service, we hung out for a long time there and never felt rushed. We went for brunch, but I can't wait to come back to try happy hour or dinner. I had a Bloody Mary that was delicious, but all of their cocktails looked fantastic. Highly recommend coming here!",65,346,25
"Came here to celebrate a birthday during brunch on a busy Sunday afternoon. Luckily we had reservations, so getting seated was a breeze. The food was fantastic and the drinks were great! We really enjoyed ourselves and part of that was due to the great food and drinks we had here. The only thing I would say that could of improved is to have some fans in the back section. The cover does keep the sun off you, but doesn't let a breeze easily flow, so the back does get a bit toasty. Other than that keep up the great work!",101,523,48
"The wait staff here will not get within a certain radius of your table if you are the only three brown folks there. No silverware, no water refill, no approaching to take the order, nothing, no thank you for coming, no how are you doing. Every SINGLE table with white folks nearby got those things without question. Thankfully the Chicano busser did much of the waiter's job for him, wouldn't want the waiter to be exposed to the melanin.",79,438,35
"Went here with a friend while visiting San Fran and was disappointed by the food.Service was good and it was very packed, so seems like they get good business. I appreciate that the menu is seasonal, which means that there are fresh and new options every few months. However, the fish that I ordered tasted so...fishy. I've never had fish that tasted like this - I think they hadn't prepared it properly, so the stink was very pungent and strong. My friends steak was also sub-par, especially at the prices we paid. We just expected something better given the good reviews and upscale quality of the restaurant. The pate was good though - just be sure to ask for extra bread!We also sat beneath a bookshelf at the back of the restaurant that seemed a little precarious. One little earthquake and I was worried the books would come crashing down!",150,845,61
"::FOOD:: 1/5 I mean it is edible, but it's flavorless. We ordered a burger, a Sunnyside Joe's, a Loco Moco, a Caesar salad, and a wild mushroom pizza. While the pizza tasted great, the rest of the food that involved meat was FLAVORLESS. Literally, no salt at all, all we tasted was, MEAT.::SERVICE:: 1/5 Water was never refilled, drinks were thrown on the table as if we wronged the waitress. She came over and asked, ""is everything good?"" I said, ""no"" but maybe she didn't hear me, she just walked away. ::PORTION:: 1/5 - the portion of everything was quite small for the price point. They are trying to make it fancy/fine-dining-like, but it isn't a place for that. Their Loco Moco was so small and taste less it's not worth ordering. It's basically a scoop of rice, a beef patty that's a little bigger than the slider size and an egg on top with a ""sweet soy sauce"" (basically a teriyaki sauce) not a typical Loco Moco brown gravy sauce.::AMBIENCE:: 3/5 it's pretty standard, nothing special. A typical gastro pub setting.::SUMMARY:: Wouldn't recommend to anyone of my friends to waste their money when there are so many better places to go to around the area.",206,1163,80
"One of the few brunch places where you can make a reservation so you don't get trapped in a line with no end (Kitchen Story, Brenda's, etc). It was full of people at 1pm, and we ended up in a corner behind the bar, but still got good service and attention. I ordered the Sunnyside Joe's, and the waiter nicely let me replace the potatoes with a side salad. My friend had the Loco Moco. The first thing I noticed when my dish came was that the eggs were unevenly cooked. One of them was super watery and gooey, while the other's yolk was fully cooked. The ground beef wasn't well-seasoned and didn't contribute much to the dish besides taking up space. My friend's Loco Moco was a little less disappointing; the sauce was apparently good, especially having soaked into the rice. But the problem with this place is that the portions are SO SMALL. It's not right to pay ~$15 for a plate of eggs and meat that won't fill you up. Make plans for dessert afterwards or order a French Toast to share. Otherwise, you'll leave unsatisfied.",189,1029,81
"I came back here today since I was in the area and enjoyed it so much last time. We were quickly seated by the bartender out to the beautiful patio in the back. We were greeted by our server and left to look over our menus. My fiancé ordered the fried chicken with French toast and an IPA and I ordered the least coast burger again, but this time I added cooked onions and blue cheese. I ordered my burger lettuce wrapped because I am gluten intolerant. Our waiter took our order without writing anything down.  I was disappointed to see my burger came out with a bun, but the server said he would get it fixed. I wish he had asked if I wanted them to make another or if it was ok for him to just lay it over lettuce. I would have preferred another, but they just lettuce wrapped the first one. When I got my plate back, my fries were cold. Still tasty, but not fresh tasting. It was just disappointing after my first visit here. My fiancé really loved his French toast and chicken- he said even though it was fried chicken, it didn't feel heavy and that the French toast was cooked perfectly. I still love the lavender lemonade! Side note: the bathroom needs more lighting. It's like walking into a haunted house- it is so dark! Overall, I am a bit disappointed with this visit. My food was nowhere near the quality that it was when I went the first time. I will likely come back, but I will be hesitant.",268,1405,108
"Holy. Moley. This place was AH-MAZING!  Cute little gastropub in San Francisco. We came in right at opening on a Wednesday for brunch/lunch. The menu is extensive and gluten Free friendly. The servers were knowledgeable about what can be prepared gluten free and what couldn't be. There was plenty of seating available, and they have this beautiful patio in the back of the restaurant and which is a great place to sit for some fresh air and to unwind. Our server was super friendly and was on top of everything we needed. Food wise, this was one of the best restaurants I've ever eaten at. I ordered their burger and had it lettuce wrapped, and added white cheddar and avocado. It was SO good and you can really taste how fresh it is. It doesn't taste frozen at all. They serve this with a heaping portion of fries and offer green goddess dressing upon request for dipping. My dad ordered the chiliquiles and he was in HEAVEN! They looked amazing, and smelled so good. He said the amount of flavor was unlike any others he had had before. I also got a lavender lemonade with my meal which wasn't overly sweet- it was just right with a perfect twist of lavender. Overall, I will for sure be back here and recommend to all my friends!",225,1233,99
"I don't really post on Yelp but had such a great experience at Starbelly! It was my first time there. I met up with a friend for a quick catch-up, we sat outdoors in the parklet. Super friendly and attentive service, amazing food (lots of vegetarian options for people like me) and reasonably priced. Seems like a great place to go with both smaller and larger groups. I look forward to dining there again and see this as being a great go-to!",82,442,34
"Eh. I mean this place does have a nice selection of food but I would stick to what's popular and skip the experimental items. We ordered the fig salad- it was good but we could have skipped this one. Fried Grits- the dipping sauce was excellent but the grits itself needed more salt or at least some sea salt on the outside of the sticks. We asked for recommendations and they had a seasonal pizza which I thought was sad...It was the corn pizza that was bland. One thing...Don't go to star belly for their pizzas.. I did like the chicken pate and thought it was a great portion and it was house made!All in all I just couldn't catch on the hype sadly, I would have loved to!",129,675,59
The wait was too long at another restaurant a block away so we strolled into this one. The food was fairly good. Loved the vibes here. Food:Donuts - goodFish tacos - goodSalted caramel pot de creme - good,38,204,10
"The worst loco moco I've ever had. Dry af across the board. The spaghetti is a little below mediocre. These dishes aren't restaurant quality, period. Drinks are wine and beer only, but they make fair attempts at cocktails with what they've got. Plus one star for that. Our main server seemed nice, though slightly uncomfortable, so plus one star for him. Finally, I'm awarding a star for the sort of outdoor seating. I'll take what I can get in SF, in this regard.",83,464,24
"First of: awesome customer service! From greeting to seating to checking up on us. It was great. Place is very clean and atmosphere is lively. Now the food: The pate was amazing! Love the onion marmalade and the mustard was on point. The mussels were impeccable! And I'm not a great seafood fan so props on making a fabulous dish. The mushroom pizza was very rich so expect a punch of a flavor. But that was already too much for me so we had to box it home. Overall, loved it. I will definitely be back for brunch on a Sunday anytime!",102,534,43
"Good for drinks. Another classic over-crowded ""alright"" brunch place. First, their service has been quite rude the past two times I've been there. I don't blame the staff, but the management seems to do shady things like - having their lunch menu on SF restaurant week, but not offering it on the weekends and not noting that anywhere on the menu.I've been here twice - once for drinks, and once for brunch. Would recommend as a cute drink place, but not going to be a go-to for food for me.For brunch, I got the sunny side joe's, which was bland and eggs were way over cooked. We also got charged for all small changes (sub arugula for cilantro on a pizza and charged $2 without telling us).",127,692,53
"The fava bean dumplings were *chef's kiss* the perfect savory bite. It was creamy, savory, and a little tangy. I loved how it was such a unique item and executed so well. The price point for the dish was a little steep at $2.5 per dumpling. The veggie burger was huge and came with a small mountain of fries. There was no indication of fries coming with the burger and maybe I should have asked, so I also ordered the fries with 3 dips. The fries were just as fries should be in taste and texture, but a lot of the pieces were quite short. The veggie patty exterior was crunchy and the bun was soft and fluffy. Maybe it's just my personal preference, but I wanted a saucier burger with a sharper flavor. The service was good.",138,725,58
"We were in SF for a friend's birthday and she selected this place for brunch. The atmosphere is nice and the patio seating looked cool. The place was very packed on a Saturday morning I wouldn't expect any less. The service was pretty quick for our party of 11. The drinks were all pretty good I loved mine which had gin and elderberry, but I can't remember the name of it. I ordered the French toast but wasn't a fan of the fruit jam or whatever it was that was spread onto it. My husband ordered the chicken and waffles which I tried and liked. The chicken was moist and the waffles were great.",114,596,48
Went here recently for lunch/brunch. The fried chicken and waffles was mediocre...the chicken was over cooked and dry. The batter was also flavorless. Their pizza was actually good - we tried one with egg on it and I would definitely order it again. Service was below average...an order for a beer during lunch took 10-15 minutes to arrive and didn't make it to the table until after we finished eating. The wait staff here seemed a bit apathetic.,78,447,31
"Cute spot, came here on a Wednesday night to catch up with some friends. There's a lot of street metered parking but the no left turns are a pain.  The food was pretty good!Appetizer: Their house made mushroom dumplings were to die for! Honestly I've had my fair share of dumplings and I wasn't expecting too much, the wrap was so amazing, it melted in my mouth. There were different layers of wraps and delicious cheese as well. It was pretty pricey though, around $11 for 3 dumplings, lol. We also had the chicken patte which was also very delicious. I enjoyed the sweet raspberry (?) sauce that it came with! Very delicious and worth trying. Main dishes: I had their spaghetti which the waitress recommended as a good start when trying out this spot, it had bacon pieces in it with thick noodles (almost like thick chow mein noodles). The sauce was a little spicy and the bacon was a good touch! The house made bangers & mash was soo good as well! It came with delicious meat with mash potatoes, sausages and apples! I loved it lol. I wasn't expecting the apples to be so delicious in the dish!Overall this spot had really interesting dishes. The waitress also told us sometimes the dishes switch around , but I enjoyed pretty much everything! Im definitely down to try different dishes here the next time I come!",237,1316,85
"One of my favorite brunch spots in the city. 1) you don't have to wake up at an ungodly hour to go and wait for a table (I'm looking at you Plow) and 2) great service, ambience and food, what more could you ask for? They've got a great outdoor back patio with heat lamps and it's super cozy and airy and bright. I haven't been for dinner, but I've been for brunch many times and it's always been excellent. Make sure to get the chicken and waffles and wash it down with a mimosa. Nothing better.",97,495,45
"Looking for a brunch spot where the price and service are up to par? In SF? With a full bar? Great menu selection? And very hipster? Try out Starbelly.  You wont regret it.  The hostess and our server were super nice.  Service was fast. And the price was just right for the plate you get.I recommend you try their ""house made chicken liver pãté with buttered bread, grain mustard and sweet onion marmalade"" (so good!)  Very light and satisfying plate and did I mention really good?!  You get a balance of sweet and salty & moist and savory.  I really liked it.  Their house cut fries with three dipping sauce was also bomb.  Great way to start  our brunch.  We also ordered their spaghetti with bacon, jalapeño, and basil. Yummy!   And one can never go wrong with their pizza margherita with fresh mozzarella and basil just because we didn't order enough carbs today. Hahaha!  There is an indoor and outdoor eating area.  The outdoor is fully tented which is aesthetically pleasing because you get the outdoor experience without having your hair blowing in your face and no flies fighting to taste your food selection!   The howling wind was nice to hear beat against the fully covered tent.  Succulents mounted on the walls were relaxing.  Nice touch.Did I mention they are furry friendly too? Cool!",226,1300,74
"Yum this place has great food and great service! They have a cute outdoor seating area in the back of the restaurant and it's slightly covered, which is great because you get the sunniness of being outdoors without overheating...I came on labor day weekend, and since my sister was visiting, we had a large party. The server was really accommodating and even split the bill for us as we requested! I tried the loco moco (plus avocado), chicken and waffles, and the burger. The chicken and waffles was good - I've had better ones elsewhere, but starbelly's was pretty decent. Everything we ate was pretty good, not amazing but definitely satisfying.We also tried their caramel pot de creme, which was delicious! It's a tiny pot of caramel pudding like stuff with some shortbread cookies on the side. Perfect for dessert!",140,819,54
"I came here past 1pm to have lunch. I don't really like giving 3 stars or less just because I know how hard it is to run a restaurant. But during my visit, the place wasn't packed. They don't looked understaffed. The place is nicely decorated but service is inattentive, we only saw our server once (during order taking), we had to get someone's attention every time we needed help; from getting a table, ordering, paying our tab. The loco moco is very tasty with their sweet sauce, but it should not be called loco moco coz loco moco is about gravy. I was looking forward to try the gravy, but there was no gravy, it was this sweet sauce which is very tasty. I liked the dish, it's just I was really looking for gravy. The French Toast is sweeter than usual since they cover the entire top bread with strawberry jam, it would have been good if it has less jam so I can actually taste the flavor of the toast itself. The POBOY chicken sandwich is good. This is one of their best stuff.",187,985,80
"This was my fourth time at Starbelly. We opted for a late brunch on Saturday this weekend. Our reservations were made in advance and we were seated as soon as we arrived.The seasonal corn and cilantro pizza had a delicious thin and crispy crust. With lime aioli drizzled on top, this pie is one of the best in SF. Our Starbelly Salad was fresh and toped with candy sweet cherry tomatoes and creamy goat cheese. A more generous portion of both was needed (we still had half a bowl of greens after we ate the fixings with the rest of the salad).The wait staff was almost too attentive. Within three minutes we were asked by three separate employees if they could take out plates. We were still working on our meals and would have appreciated better communication between the front of house team.",143,793,59
"If I'm being honest, I liked the atmosphere here better than the food. I ordered the spaghetti which had quite a bit of hype here on Yelp, and I've got to say... it kind of failed to live up to the high expectations I had. It was just a basic plate of spaghetti with some chopped up jalapeños and chunks of the non-fatty part of pork belly. It was OK. Would I order it again? Probably not. On the contrary, my friend loved it and raved about it to some of our coworkers the next day... so maybe it's a case of different strokes for different folks. :/",108,551,49
"Pretty good service. Food was eh-ok, nothing to rave about. Had the fries appetizers, the dips were pretty bland, the ""basil aioli"" not much flavor at all. Had the Otro Diablo cocktail, definitely lacked some punch, disappointing. Tasted pretty water down or something, not sure how to explain. The good news, is they had some great beers on draft. The spaghetti pasta was tasty! The leftover spaghetti sauce ended up being a great dipping sauce for our leftover pizza crust. LOL - The broccoli pizza could've used some extra olive oil + garlic. The po-boy chicken was a hit. All in all, it was an ""okay"" dinner, but probably won't return. Something was missing. Palms facing up??",117,680,36
"Starbelly has a nice bright patio in the back with bench seating. They can also easily accommodate large groups.I've only been here a few times for lunch, where it's quiet and uncrowded. The mushroom pizza is always a favorite, with the Starbelly pizza a close second. The spaghetti is great in its simplicity. The bibb salad was pretty fresh and nicely balanced. Others seemed to enjoy the burger on challah bun.Solid place for a solid meal.",76,442,30
I freakin love this place so much. Delicious food and good vibes. The patio seating is super cute!! I love the Starbelly Bacon Pizza and Brussels sprouts ughhhh obsessed is an understatement!! Def one of my fave places in the city.,41,231,12
"An interesting thing happens when people ask for restaurant recommendations in the Castro:  They're steered away from Castro Street itself and you can see them pointing back down the street with a questioning look on their face saying ""nothing in that direction?""  Nothing in that direction.  Starbelly fills a void in the 'hood that's seemingly missing from Castro Street itself.  Brunch, lunch, and dinner are served 7-days per week (though not round-the-clock) in an upscale, ""now"" environment.  Think light wood furnishings, a menu written entirely in lower case font, and plates featuring Prather Ranch burgers, Little Gem salads, dishes with added aged-cheddar, and house-pickled jalapeños.  The fact that you recognize this menu as being from the time we live in is what distinguishes it from some other open-all day places directly on Castro.  At any time I'd say the place to dine here is the back patio.  In fact, for a recent weekday lunch I walked through an essentially empty restaurant to reach that attractive (and packed) al fresco spot.  On a beautiful day, everything will look better from here.  My waiter approached with big, full bottles of still and sparkling water and my table opted for both.  I was relieved to learn that there was no upsell here.  Even sparkling water, which they apparently carbonate themselves on-site, was provided free of charge. My salad (Bibb lettuce, grilled chicken, bacon, cherry tomatoes, & green goddess dressing, $13) was presented beautifully and was well-priced for a filling lunchtime meal in such an attractive setting.  Could the salad have benefited from crispier bacon and more ample and flavorful dressing?  It could have, but the fact that it didn't wasn't a dealbreaker.I think that Starbelly is a great (though far from recent) addition to the neighborhood: Good food, reasonable pricing, free and ample sparkling water.  When people ask, I will happily and confidently point them away from Castro Street and towards Starbelly's patio for an enjoyable experience.",324,2029,117
Came here for lunch today after not having been for years and it was terrible from start to finish. I ordered a salad with fried chicken on it and the chicken was undercooked and gross not to mention they forgot the avocado. I asked for the avocado three times and finally when I was nearly done with my salad someone brought it. Not great meal combine with the inattentive service means I won't be coming back again,77,416,36
